letter_id,letter_name,sender,recipient,recipient_english,year,date,location,location_english,text,text_english,letter_category,to
121,"Letter to L. D. Skalon, 1897",Sergei Rachmaninoff,Л. Д. Скалон,L. D. Skalon,1897,1897-11-22,Москва,Moscow,"Сердитесь вы на меня или не сердитесь, дорогая Лелёша, за то, что я так долго вам не отвечал на ваше письмо? Думаю всё-таки, что нет, потому что если у меня и появляется свободных несколько минут, то я их, ей-богу ж, нахожу возможным уделять только на отдых, на спокойное сидение после периодичной беготни в театр, после действующих на нервы театральных занятий и беспорядков.
 
 
 У нас ведь действительно в театре царствует настоящий хаос. Никто не знает, что будет не только послезавтра, а что будет завтра, даже сегодня. Петь некому, не потому, что певцов нет, а потому, что из нашей большой труппы в 30 человек вроде 25 человек за негодностью нужно выгнать. Давать также нечего. Т. е. опять-таки репертуар огромный, но всё идёт так скверно, так грязно (за исключением одной «Хованщины»), что 95% репертуара нужно или совсем выкинуть, или переучить по-настоящему.
 
 
 Театр не достигает ни художественной, ни коммерческой хорошей стороны. Например, в близком будущем решено возобновить «Аскольдову могилу» и «Громобой» Верстовского. Ну скажите, пожалуйста, будет ли какой-нибудь художественный или коммерческий толк от этих поганых опер? Когда же я предложил вместо этого поставить всего «Манфреда» Шумана с Шаляпиным в заглавной роли, то мне ответили, что тогда вместо частной оперы выйдет литературно-артистический кружок. Как будто в вышеуказанных операх нет простого разговора вместо речитативов?
 
 
 Беда наша в том, что главные наши заправилы или не особенно умные люди в музыкальном деле, или не особенно честные. Плохо ещё то, что нами заведует не один хозяин, а десять хозяев, причём каждый говорит что-нибудь своё, что не согласно с мнением другого. Но хуже всего то, что С. Мамонтов сам нерешителен и поддаётся всякому мнению. Например, я его так увлёк постановкой «Манфреда», что он тут же приказал его ставить. Не прошло и пяти минут, как его приятель художник Коровин, не понимающий ничего в музыке (но, кстати, очень милый и хороший человек, как и С. Мамонтов), отговорил его. Положим, я попробую его ещё склонить на это.
 
 
 Лишь бы Шаляпин согласился не петь, а говорить. А ведь Шаляпин должен быть в «Манфреде» прямо великолепен. Что касается данных мне опер «Рогнеды» и «Снегурочки», то я сам уговариваю их не ставить ввиду того, что они превосходно идут в Большом театре, а у нас ни времени, ни сил нет поставить их хоть сносно. Постановка их — верный провал! Постановка «Юдифь» отодвинута. Пойдёт после «Садко», значит приблизительно в десятых числах января. Да и исполнительница «Юдифи» ещё не найдена. 28-го ноября, вероятно, пойдёт со мной в первый раз «Кармен». 26-го ноября дебютирует со мной в первый раз в роли сопрано (Наташа) Любатович в «Русалке». В общем это идёт так плохо всё, что я боюсь заболеть припадком чёрной меланхолии. Ей-богу же!
 
 
 Всё-таки я служу ещё пока в театре и надеюсь выдержать эту службу до конца сезона, хотя, исключая денежной стороны, мне никакой пользы это время не принесёт, потому что дирижёрский Рубикон я перешёл, и мне теперь нужно только безусловное внимание и подчинение к себе оркестра, чего я как второй дирижёр никогда от них не дождусь. Между прочим, один из этих господ недавно при всей публике и оркестре дал пощёчину Эспозито за, будто бы, какую-то ужасную брань, сказанную последним. Составлен протокол. Музыкант этот, говорят, так ловко его ударил, что Эспозито был сшиблен с ног и пенсне его сломалось. Боже мой! Дело будет разбираться у мирового судьи. У меня начинается припадок меланхолии. Чтобы это со мной было? Избави боже!.. Эспозито продолжает дирижировать!
 
 
 Мой привет Верочке, Татуше и всем вашим. Целую ваши ручки.
 
 
 Ваш С. Р.
 
 
 © https://senar.ru/letters/121","Are you angry with me or not, dear Lelesha, for not answering your letter for so long? I still think not, because if I have a few free minutes, then, by God, I find it possible to devote them only to rest, to sitting quietly after the periodic running to the theater, after the theater classes and riots that get on my nerves.

In our theater, there really is real chaos. No one knows what will happen not only the day after tomorrow, but what will happen tomorrow, even today. There is no one to sing, not because there are no singers, but because out of our large troupe of 30 people, about 25 people need to be fired for unsuitability. There is also nothing to give. That is, again, the repertoire is huge, but everything is going so badly, so dirty (with the exception of one ""Khovanshchina"") that 95% of the repertoire needs to be either thrown out completely, or really retrained.

The theatre does not achieve either artistic or commercial goodness. For example, in the near future it has been decided to renew Verstovsky's ""Askold's Grave"" and ""Stormbreaker"". Well, please tell me, will there be any artistic or commercial benefit from these lousy operas? When I suggested instead staging Schumann's entire ""Manfred"" with Chaliapin in the title role, I was told that instead of a private opera there would be a literary and artistic circle. As if the above-mentioned operas do not have simple conversation instead of recitatives?

Our trouble is that our main bosses are either not particularly smart people in the music business, or not particularly honest. Another bad thing is that we are managed not by one owner, but by ten owners, and each one says something of his own, which does not agree with the opinion of the others. But the worst thing is that S. Mamontov himself is indecisive and succumbs to any opinion. For example, I got him so carried away by the production of Manfred that he immediately ordered it to be staged. Not even five minutes had passed when his friend the artist Korovin, who doesn’t understand anything about music (but, by the way, a very nice and good person, like S. Mamontov), ​​talked him out of it. Let’s say I’ll try to persuade him to do it again.

If only Chaliapin would agree to speak instead of sing. And Chaliapin should be absolutely magnificent in Manfred. As for the operas Rogneda and Snegurochka that were given to me, I myself am trying to persuade them not to stage them because they are going great at the Bolshoi Theatre, and we have neither the time nor the strength to stage them even tolerably. Their production is a sure failure! The production of Judith has been postponed. It will be staged after Sadko, which means around the tenth of January. And the performer of Judith has not yet been found. On November 28th, Carmen will probably be performed with me for the first time. On November 26th, Lyubatovich will debut with me for the first time as a soprano (Natasha) in Rusalka. In general, everything is going so badly that I am afraid of falling ill with a fit of black melancholy. By God!

After all, I am still serving in the theater and I hope to endure this service until the end of the season, although, excluding the financial side, this time will not bring me any benefit, because I have crossed the conducting Rubicon, and now I only need the unconditional attention and subordination of the orchestra, which I will never get from them as a second conductor. By the way, one of these gentlemen recently slapped Esposito in front of the entire audience and the orchestra for, supposedly, some terrible curse words uttered by the latter. A report has been drawn up. This musician, they say, hit him so deftly that Esposito was knocked down and his pince-nez broke. My God! The matter will be heard by a justice of the peace. I am beginning to have a fit of melancholy. What is happening to me? God forbid!.. Esposito continues conducting!

My greetings to Verochka, Tatusha and all of yours. I kiss your hands.

Yours S. R.

© https://senar.ru/letters/121""",personal: check-in,fatigued
107,"Letter to M. A. Slonov, 1897",Sergei Rachmaninoff,М. А. Слонову,M. A. Slonov,1897,1897-02-16,Москва,Moscow,"Очень прошу тебя, милый друг Михаил Акимович, зайти без меня посидеть с Родной. Лучше всего в понедельник. Просил об этом и Юрия. Он будет, по крайней мере обещал быть, также у ней в понедельник. Сделай это, пожалуйста, для меня.
 
 
 Твой С. Рахманинов","I beg you, dear friend Mikhail Akimovich, to come and sit with Rodnaya without me. Monday would be best. I asked Yuri about this too. He will be, or at least promised to be, also at her place on Monday. Please do this for me.
 
 Yours S. Rachmaninov",personal: social,apologetic
116,"Letter to M. A. Slonov, 1897",Sergei Rachmaninoff,М. А. Слонову,M. A. Slonov,1897,1897-09-08,"им. Игнатово, Нижегородской губ","Ignatovo, Vladimir Oblast","Наш день отъезда отложен на одни сутки, милый друг Михаил Акимович, а посему жду тебя у Лодыженской не 12-го, как написал тебе, а 13-го.
 
 Надеюсь, что увижу тебя, если ты будешь свободен.
 
 Твой С. Рахманинов
 
 © https://senar.ru/letters/116","Our departure day has been postponed for one day, dear friend Mikhail Akimovich, and therefore I am waiting for you at Lodyzhenskaya not on the 12th, as I wrote to you, but on the 13th.
 
 I hope to see you if you are free.
 
 Yours, S. Rachmaninov
 
 © https://senar.ru/letters/116",personal: check-in,melancholy
123,"Letter to M. A. Slonov, 1897",Sergei Rachmaninoff,М. А. Слонову,M. A. Slonov,1897,1897-12-30,Москва,Moscow,"Милый Миша! Приехал неожиданно Римский-Корсаков, которого сегодня на «Садко» предполагают чествовать. Сообщаю тебе об этом — ты, вероятно, захочешь быть также. Родная также едет по этому случаю. Кстати, ответь, не можешь ли ты сейчас сюда приехать, чтобы её довезти. Приезжай скорей, может быть, и я тебя ещё дождусь.
 
 
 Твой С. Р.
 
 
 Ответь на словах.
 
 
 © https://senar.ru/letters/123","Dear Misha! Rimsky-Korsakov has arrived unexpectedly, and they are planning to honor him at Sadko today. I am informing you about this — you will probably want to be there too. My dear one is also coming for this occasion. By the way, tell me if you can come here now to give her a ride. Come quickly, maybe I will wait for you too.

Yours S. R.

Answer verbally.

© https://senar.ru/letters/123""",personal: check-in,affectionate
111,"Letter to M. Yu. Kreutzer, 1897",Sergei Rachmaninoff,М. Ю. Крейцеру,M. Yu. Kreutzer,1897,1897-05-28,"им. Игнатово, Нижегородской губ","Ignatovo, Vladimir Oblast","Прости меня, милый друг Максимилиан Юльевич, за поздний ответ на твоё милое письмо, которое заставило меня очень смеяться.
 
 
 Я хочу тебя поблагодарить от души за приглашение и сказать тебе, что я, вероятно, им и воспользуюсь.
 
 
 Хотя я и не забыл некоторых изречений Пруткова, но я всё-таки, несмотря также и на твоё предупреждение в письме, хочу попробовать крепко «объять» тебя.
 
 
 Передай мой искренний привет всем твоим.
 
 
 Твой С. Рахманинов
 
 
 Напомни своей сестре, что к 1-му июля жду от неё гармонические задачи по следующему адресу: Нижегородская губерния, Княгининский уезд, почтовое [отделение] Крутец, село Игнатово. Генералу Скалону с передачей мне.
 
 
 © https://senar.ru/letters/111","""Forgive me, dear friend Maximilian Yulievich, for the late reply to your sweet letter, which made me laugh a lot.
 
 I want to thank you from the bottom of my heart for the invitation and tell you that I will probably take advantage of it.
 
 Although I have not forgotten some of Prutkov's sayings, I still, despite your warning in the letter, want to try to ""embrace"" you tightly.
 
 Give my sincere greetings to all yours.
 
 Yours, S. Rachmaninov
 
 Remind your sister that by July 1 I expect harmonic problems from her at the following address: Nizhny Novgorod province, Knyagininsky district, post office Krutets, village Ignatovo. To General Skalon with delivery to me.
 
 © https://senar.ru/letters/111""",personal: apology,apologetic
109,"Letter to N. D. Skalon, 1897",Sergei Rachmaninoff,Н. Д. Скалон,N. D. Skalon,1897,1897-03-18,Новгород,Veliky Novgorod,"Я приехал сюда вчера утром, дорогая Татуша, и сегодня вечером уезжаю отсюда. Меня не ждали утром, а посему меня не встретили. Я приехал к бабушке в семь часов утра, она одна только встала уже. (Володя с женой ещё не вставали.) По дороге мне пришлось спать всего три часа — не больше, так как вчерашний день я почти весь дремал, но спать не ложился, дабы посидеть со своими. Моя бабушка совсем не стареет, по-моему. Всё такая же.
 
 
 Володя мне очень нравится. По всему, что я видел и слышал, он очень хороший человек. Мне приходится о нём говорить так, как будто я его вижу в первый раз в своей жизни. Жена его очень миленькая, очень симпатичная и совсем не глупая. По-видимому, они любят страшно друг друга. Она только на него и смотрит и веселеет только тогда, когда он начинает что-нибудь рассказывать. Затем она поддерживает только тот разговор, который он начинает. Мне весело на них смотреть. Мне очень приятно это видеть, и я готов просить бога, чтоб у них эти чудные отношения не пропадали бы со временем. Они ещё так мало времени женаты! Все меня очень просят остаться ещё на день — но я не соглашусь...
 
 
 Теперь я хочу поблагодарить Вас и Ваших сестёр за деньги, которые вы мне дали на дорогу. Когда я поехал от Вас к Глазунову и представил себе, что вдруг мне пришлось бы сейчас просить у него в долг денег, то пришёл прямо в ужас от одной этой мысли. Я бы, впрочем, всё-таки и не спросил бы их у него в конце концов, если бы даже у меня не было бы в кармане ваших. Язык бы не повернулся...
 
 
 От него я заезжал к Варлиху. Он мне сказал, что, вероятно, назначит Цыганское Каприччио в программу их концерта на Фоминой неделе. Я обещал ему приехать. Если это он исполнит, то я, вероятно, и приеду.
 
 
 До свиданья. Благодарю Вас и Ваших сестёр ещё раз за чудное отношение, трогательное для меня внимание ко мне, которое я от Вас видел. Целую крепко шесть Ваших ручек. Всем кланяюсь.
 
 
 Ваш С. Рахманинов
 
 
 P. S. Маленькая подробность. Я пишу сейчас здесь, а бабушка не позволяет никому в соседних комнатах по этому случаю разговаривать.
 
 
 © https://senar.ru/letters/109","I arrived here yesterday morning, dear Tatusha, and I am leaving here this evening. I was not expected in the morning, and therefore I was not met. I arrived at my grandmother's at seven o'clock in the morning, she was the only one who had already gotten up. (Volodya and his wife were not up yet.) On the way I had to sleep only three hours - no more, since yesterday I dozed almost all day, but did not go to bed in order to sit with my people. My grandmother is not getting old at all, in my opinion. She is still the same.
 
 I like Volodya very much. From everything I have seen and heard, he is a very good man. I have to talk about him as if I were seeing him for the first time in my life. His wife is very sweet, very nice and not at all stupid. Apparently, they love each other terribly. She only looks at him and becomes cheerful only when he begins to tell something. Then she supports only the conversation that he begins. It is fun for me to look at them. I am very pleased to see this, and I am ready to ask God, that this wonderful relationship would not disappear with time. They have been married for so little time! Everyone is asking me to stay another day - but I will not agree...
 
 Now I want to thank you and your sisters for the money you gave me for the trip. When I went from you to Glazunov and imagined that I would suddenly have to ask him for a loan, I was horrified by this thought alone. However, I still would not have asked him for it in the end, even if I did not have your money in my pocket. My tongue would not have turned...
 
 From there I stopped by Varlikh. He told me that he would probably include Gypsy Capriccio in the program of their concert on St. Thomas's Week. I promised him to come. If he performs it, then I will probably come.
 
 Goodbye. I thank you and your sisters once again for your wonderful attitude, touching attention to me, which I have seen from you. I kiss your six little hands. I bow to everyone.
 
 Yours S. Rachmaninov
 
 P.S. A small detail. I am writing here now, and my grandmother does not allow anyone in the neighboring rooms to talk on this occasion.
 
 © https://senar.ru/letters/109",professional: logistics,affectionate 
