letter_id,letter_name,sender,recipient,recipient_english,year,date,location,location_english,text,text_english,letter_category,to
156,"Letter to M. A. Slonov, 1900",Sergei Rachmaninoff,М. А. Слонову,M. A. Slonov,1900,1900-05-10,Ялта,Yalta,"Милый друг Михаил Акимович!
 
 
 Вчера пришло твоё письмо. Я был очень рад его получить, а также узнать, что Вы хорошо устроились, что у Вас красиво, удобно, весело. Я с большим удовольствием воспользовался бы Вашим приглашением, если б это было можно. Но это мне неудобно. Сейчас я не хочу отрываться от занятий, а в июне, на пути за границу, мне пришлось бы большой крюк сделать, чтобы к Вам попасть, и это потому, что маршрут я изменил, т. е. я не еду через Константинополь из-за чумного карантина (о чём и Федю уже известил), а еду через Одессу и Варшаву. Со мной едет, кажется, А. Чехов, по крайней мере уговаривался. Таким образом, Батум совсем не по пути. И это, повторяю, мне очень жалко, потому что я с удовольствием пожил бы у Вас с Вами. Как-нибудь до другого раза. О себе писать почти нечего. Занимаюсь не особенно много, но аккуратно. Живу покойно и тихо — и это довольно скучно. В городском саду и на набережной встречаю очень много знакомых, но редко к ним хожу сидеть. Больше всё дома и притом у себя в комнате. Видишь, как это всё скучно и неинтересно.
 
 
 Передай всем твоим мой привет и благодарность за приглашение. Анне Тимофеевне особо желаю набираться побольше сил и впечатлений для новых и новых рассказов, нам во утешение.
 
 
 Крепко тебя обнимаю. Пиши мне, пожалуйста.
 
 
 С. Рахманинов
 
 
 © https://senar.ru/letters/156","Dear friend Mikhail Akimovich!
 
 Your letter arrived yesterday. I was very glad to receive it, and also to learn that you have settled in well, that it is beautiful, comfortable, and fun. I would gladly accept your invitation, if it were possible. But it is inconvenient for me. Now I do not want to be interrupted by my studies, and in June, on my way abroad, I would have to make a big detour to get to you, and this is because I have changed my route, i.e. I am not going through Constantinople because of the plague quarantine (which I have already informed Fedya about), but I am going through Odessa and Warsaw. It seems that A. Chekhov is going with me, at least he agreed. Thus, Batumi is not on the way at all. And I repeat, I am very sorry about this, because I would gladly live with you with you. Somehow until another time. There is almost nothing to write about myself. I am not studying very much, but I am careful. I live a quiet and peaceful life - and it's quite boring. I meet a lot of friends in the city garden and on the embankment, but I rarely go to sit with them. Mostly at home, and in my room. You see how boring and uninteresting it all is.
 
 Give my regards to all of you and my gratitude for the invitation. I especially wish Anna Timofeevna to gain more strength and impressions for new and new stories, for our consolation.
 
 I hug you tightly. Write to me, please.
 
 S. Rachmaninov
 
 © https://senar.ru/letters/156",professional: logistics,affectionate 
158,"Letter to M. I. Tchaikovsky, 1900",Sergei Rachmaninoff,М. И. Чайковскому,M. I. Tchaikovsky,1900,1900-06-14 - 1900-06-27,Варацце,Return,"Уважаемый Модест Ильич!
 
 
 Ваше письмо меня не застало уже в Крыму, а мне его переслали сюда, в Италию. Сегодня я его получил и спешу Вам ответить. С тех пор, как я был у Вас в Клину, прошло два года, и в эти два года я, кроме одного романса, не сочинил ни одной ноты. Вообще эту способность сочинять я потерял совершенно, по-видимому, и все мои помыслы направлены к тому, чтобы её вернуть. Говоря искренно, я хотел именно этим летом попробовать писать опять «Франческу», надеялся, что, может быть, теперь что-нибудь выйдет и вот почему я хочу Вас просить, если Вам покажется это возможным, написать Вашему кандидату, ну хоть бы то, что Рахманинов теперь за границей и что ответ относительно «Франчески» Вы дадите по его возвращении, т. е. в сентябре, когда я обязуюсь, в случае если у меня опять ничего не выйдет, отказаться от сюжета.
 
 
 Если же это невозможно, то скажите, и я сейчас пришлю Вам либретто. Хотя Вы и не для меня специально работали над этим либретто, но рисковать Вас опять оставить без композитора для него не смею, конечно.
 
 
 Преданный Вам С. Рахманинов
 
 
 Мой адрес: Italia. Varazze.
 
 
 Provincia di Genova. Maison Lunelli.
 
 
 © https://senar.ru/letters/158","Dear Modest Ilyich!
 
 Your letter did not find me in Crimea, but it was forwarded to me here, in Italy. Today I received it and I hasten to answer you. Two years have passed since I was with you in Klin, and in these two years, except for one romance, I have not composed a single note. In general, I have lost this ability to compose completely, apparently, and all my thoughts are directed towards returning it. To be honest, I wanted to try to write Francesca again this summer, hoping that maybe now something will come of it, and that is why I want to ask you, if you think it possible, to write to your candidate, well, at least that Rachmaninov is now abroad and that you will give an answer regarding Francesca upon his return, i.e. in September, when I undertake, in the event that I again fail, to abandon the subject.
 
 If this is impossible, then tell me, and I will send you the libretto right now. Although you did not work on this libretto specifically for me, I certainly do not dare to risk leaving you without a composer for it again.
 
 Yours faithfully, S. Rachmaninov
 
 My address: Italia. Varazze.
 
 Provincia di Genova. Maison Lunelli.
 
 © https://senar.ru/letters/158",personal: check-in,neutral
160,"Letter to M. I. Tchaikovsky, 1900",Sergei Rachmaninoff,М. И. Чайковскому,M. I. Tchaikovsky,1900,1900-07-05 - 1900-07-18,Варацце,Return,"Многоуважаемый Модест Ильич.
 
 
 Благодарю Вас очень за Ваше письмо и за разрешение оставить пока у себя Ваше либретто. Итак, в сентябре я дам положительный ответ. Скоро я уезжаю отсюда. На всякий случай пишу Вам свой адрес: Воронежская губерния, почтовая станция Красненькая.
 
 
 Уважающий Вас С. Рахманинов
 
 
 © https://senar.ru/letters/160","Dear Modest Ilyich.
 
 Thank you very much for your letter and for allowing me to keep your libretto for now. So, in September I will give a positive answer. I am leaving here soon. Just in case, I am writing you my address: Voronezh province, Krasnenkaya post station.
 
 Yours sincerely, S. Rachmaninov
 
 © https://senar.ru/letters/160",personal: check-in,neutral
155,"Letter to N. D. Skalon, 1900",Sergei Rachmaninoff,Н. Д. Скалон,N. D. Skalon,1900,1900-05-08,Ялта,Yalta,"Хочу вам написать несколько строчек, милая Татуша, чтобы вас поблагодарить за ваше письмо, и за ваше приглашение, которым, может быть, я воспользуюсь. Попрошу вас ещё извиниться перед вашим отцом за меня. Когда он был в Москве, он просил меня присмотреть ему пианино, которое он хотел бы купить для Лукино. Я обещал и об этом своём обещании вспомнил только накануне своего отъезда, когда ничего уже не мог сделать. Хорошо ещё, что я видел вашу сестру Веру, которую и просил сходить в один магазин, где бы она поговорила о покупке пианино от моего имени. Чем кончились её разговоры, я не знаю, конечно.
 
 
 Итак, попросите, пожалуйста, за меня извинения. Очень прошу! Я буду вам писать непременно, милая Татуша, и непременно на таких письмах с видами, о которых вы меня просите.
 
 
 Затем до свидания. Крепко целую ваши ручки и желаю вам от всего сердца всего лучшего. Надеюсь, что вы напишете!
 
 
 Ваш С. Р.
 
 
 Я здоров. Живу тихо и спокойно, а это довольно скучно.
 
 
 © https://senar.ru/letters/155","I want to write you a few lines, dear Tatusha, to thank you for your letter and for your invitation, which I may take advantage of. I will also ask you to apologize to your father for me. When he was in Moscow, he asked me to look after a piano for him, which he wanted to buy for Luchino. I promised and remembered this promise only on the eve of my departure, when I could no longer do anything. It is good that I saw your sister Vera, whom I asked to go to a store where she could talk about buying a piano on my behalf. How her conversation ended, I do not know, of course.
 
 So, please apologize for me. I beg you very much! I will certainly write to you, dear Tatusha, and certainly on such letters with the views that you ask me about.
 
 Then goodbye. I kiss your hands warmly and wish you all the best with all my heart. I hope that you will write!
 
 Yours S. R.
 
 I am healthy. I live quietly and calmly, and this is rather boring.
 
 © https://senar.ru/letters/155",personal: apology,melancholy
161,"Letter to N. D. Skalon, 1900",Sergei Rachmaninoff,Н. Д. Скалон,N. D. Skalon,1900,1900-07-09 - 1900-07-22,Варацце,Return,"Милая Татуша, благодарю Вас за Ваше письмо и прошу Вас извинить за поздний на него ответ. Причин этому много — всех не перескажешь. Не хочу Вам также описывать свои впечатления от своей поездки, на бумаге это трудно сделать. Откладываю разговор об этом до нашего свидания.
 
 
 Пока скажу Вам, что здесь я пробуду теперь недолго, по крайней мере думаю выехать не позже 20-го числа. Уезжаю отсюда (не хочу скрывать) с большим удовольствием. Мне скучно без русских и России. Я увидел, что путешествовать одному ещё можно, пожалуй, за границей; но жить одному, без семьи, или без людей её заменяющих, тяжело.
 
 
 Итак, недели через две я в России. Ни в Париж, ни в Обераммергау не поеду... Благодарю Вас за Ваше приглашение. Жалею, что не могу им воспользоваться, так как обещал уже Крейцер, что приеду к ним. Что же касается до нашего свидания, о котором я упомянул на первой странице, то я думаю, что оно произойдёт в Ивановке, куда я думаю на несколько дней приехать или теперь, или в августе.
 
 
 Если захотите меня порадовать Вашим письмом, то пишите с 20-го числа уже на адрес Крейцер: Воронежская губерния, почтовая станция Красненькая, Сергею Васильевичу Рахманинову.
 
 
 До свидания.
 
 
 Искренно преданный С. Рахманинов
 
 
 © https://senar.ru/letters/161","Dear Tatusha, thank you for your letter and ask you to excuse my late reply. There are many reasons for this - I can't tell you all of them. I also don't want to describe my impressions of my trip to you, it's hard to do on paper. I'm putting off talking about this until our meeting.
 
 For now I'll tell you that I won't be here long now, at least I think I'll leave no later than the 20th. I'm leaving here (I don't want to hide it) with great pleasure. I'm bored without Russians and Russia. I've seen that traveling alone is still possible, perhaps, abroad; but living alone, without a family, or without people replacing it, is hard.
 
 So, in about two weeks I'll be in Russia. I won't go to Paris or Oberammergau... Thank you for your invitation. I regret that I can't take advantage of it, since I've already promised Kreutzer that I'll come to them. As for our meeting, which I mentioned on the first page, I think it will take place in Ivanovka, where I am thinking of coming for a few days either now or in August.
 
 If you want to please me with your letter, then write from the 20th to the address Kreutzer: Voronezh province, Krasnenkaya post station, Sergei Vasilievich Rachmaninov.
 
 Goodbye.
 
 Sincerely devoted S. Rachmaninov
 
 © https://senar.ru/letters/161",professional: logistics,neutral
164,"Letter to N. D. Skalon, 1900",Sergei Rachmaninoff,Н. Д. Скалон,N. D. Skalon,1900,1900-08-12,"им. Красненькое, Воронежской гу","Krasnenkoe, Voronezh province","Вчера получил Ваше письмо, милая Татуша, и вот уже сегодня я на него отвечаю. Согласитесь, что это, по меньшей мере, аккуратно! Положим, многоречив я не буду, или, вернее, не могу быть потому, что занят. Хочу Вам сказать только, что был рад прочесть Ваше письмо, это во-первых, — а во-вторых, хочу Вам сказать, что через неделю собираюсь быть в Ивановке, где буду ждать Вашего письменного указания относительно того, где и когда должно произойти наше свидание. В Ивановке рассчитываю пробыть около недели.
 
 
 Буду от души рад Вас видеть.
 
 
 Ваш С. Рахманинов
 
 
 © https://senar.ru/letters/164","Yesterday I received your letter, dear Tatusha, and today I am already answering it. You must admit that this is, at the very least, neat! Let's say I won't be verbose, or rather, I can't be because I am busy. I just want to tell you that I was glad to read your letter, firstly, and secondly, I want to tell you that in a week I am going to be in Ivanovka, where I will be waiting for your written instructions regarding where and when our meeting should take place. I expect to stay in Ivanovka for about a week.
 
 I will be sincerely glad to see you.
 
 Yours, S. Rachmaninov
 
 © https://senar.ru/letters/164",personal: check-in,anxious
171,"Letter to N. R. Kochetov, 1900",Sergei Rachmaninoff,Н. Р. Кочетову,N. R. Kochetov,1900,1900-12-02,Москва,Moscow,"Дорогой Николай Разумникович.
 
 
 Я был всё время болен и только сегодня еле встал, чтоб репетировать с оркестром свой Концерт. Узнал сегодня же, что по какому-то недоразумению билет в «Московский листок» не был послан. Я отыскал единственный билет (простите, что такое плохое место) и посылаю его Вам. Не думайте, ради бога, что я хочу Вас видеть на концерте из-за каких-нибудь выгодных планов — нет! — буду просто и искренно рад, если Вы придёте меня послушать.
 
 
 Ваш С. Рахманинов
 
 
 © https://senar.ru/letters/171","ear Nikolai Razumnikovich.
 
 I was sick all the time and only today I barely got up to rehearse my Concerto with the orchestra. I learned today that due to some misunderstanding the ticket to the ""Moskovsky Listok"" was not sent. I found the only ticket (forgive me for such a bad seat) and am sending it to you. For God's sake, do not think that I want to see you at the concert because of some advantageous plans - no! - I will be simply and sincerely glad if you come to listen to me.
 
 Yours S. Rachmaninov
 
 © https://senar.ru/letters/171",professional: logistics,happy
157,"Letter to N. S. Morozov, 1900",Sergei Rachmaninoff,Н. С. Морозову,N. S. Morozov,1900,1900-06-14 - 1900-06-27,Варацце,Return,"11-го числа приехал сюда, Никита Семёнович! Если не сел тебе отвечать сейчас же, то только оттого, что у нас здесь в доме полная неурядица. Сегодня я хоть свою комнату знаю, и бумаги с чернилами себе достал, и то слава богу! А то бегают, перестанавливают, убирают, и пылят, — а жара сама по себе ещё. Беда просто! В настоящую минуту моя комната заперта. Не привык я к такому беспорядку!.. Имею тебе сообщить две вещи. Во-первых, что я глубоко сожалею, что поехал сюда, а не с тобой. А во-вторых, что в Париж я не поеду, так как за эту дорогу издержал денег больше, чем предполагал. И выходит в итоге опять тоска одна. Может быть, ты заедешь сюда? И то вряд ли, потому что ты не любишь изменять то, что уже решил. Ну, тогда до свиданья! Жму твою руку.
 
 
 Твой С. Рахманинов
 
 
 На всякий случай мой адрес: Italia. Varazze. Provincia di Genova. Maison Lunelli. Monsieur Serge Rachmaninov.
 
 
 © https://senar.ru/letters/157","Arrived here on the 11th, Nikita Semyonovich! If I haven't sat down to answer you right away, it's only because we have total chaos here at home. Today I at least know my room, and I got myself some paper and ink, and thank God for that! Otherwise, they're running around, rearranging, cleaning, and raising dust, and the heat itself. It's just a disaster! At the moment, my room is locked. I'm not used to such disorder!.. I have two things to tell you. First, that I deeply regret coming here and not with you. And second, that I won't go to Paris, since I spent more money on the trip than I expected. And in the end, it's just sadness again. Maybe you'll stop by here? And even then, it's unlikely, because you don't like to change what you've already decided. Well, then, goodbye! I shake your hand.
 
 Yours S. Rachmaninov
 
 Just in case, my address: Italy. Varazze. Province of Genoa. Maison Lunelli. Monsieur Serge Rachmaninov.
 
 © https://senar.ru/letters/157",personal: check-in,neutral
