letter_id,letter_name,sender,recipient,recipient_english,year,date,location,location_english,text,text_english,letter_category,to
132,"Letter to M. I. Tchaikovsky, 1898",Sergei Rachmaninoff,М. И. Чайковскому,M. I. Tchaikovsky,1898,1898-08-28,"им. Путятино, Владимирской губ","Putyatino, Vladimir province","Я надеюсь, дорогой Модест Ильич, что это письмо застанет Вас ещё в Петербурге. Пишу Вам с целью поблагодарить Вас, во-первых, за присланное либретто, которое мне в общем очень и очень нравится и на котором я остановлюсь. Во-вторых, я буду просить Вас исполнить одну мою просьбу и, в-третьих, мне необходим Ваш ответ на некоторые мои вопросы касательно либретто.


Просьба такая. Я желал бы, чтобы Вы присочинили мне строф тридцать для невидимого хора в прологе. Пусть не тридцать, но всё-таки известное количество слов, которое я бы разделил и поручил бы петь разным группам хора. Кроме того, 7 строф Виргилия (которые начинаются словами «Мой сын») я хотел бы отдать также хорам, изменивши, конечно, везде местоимение «оне, они» на «мы».


Найдёте ли Вы это возможным? Мне бы очень хотелось, чтобы Вы сказали «да», а то иначе, не удовлетворяясь одной только фразой в либретто, что слышны стоны, мне придётся писать симфоническую картину только для оркестра, что немного досадно, потому что в моём распоряжении есть и хоры, раз я пишу оперу. Дайте мне, ради бога, этих слов Модест Ильич!


Теперь вопрос. Мне хотелось бы знать, откуда Вы взяли содержание первого и второго действия? Разработали Вы сами фабулу о Франческе, которая известна, или рассказ о жизни её был кем-нибудь написан раньше? Затем иностранные слова, встречающиеся во время самой свадьбы? Что означают эти слова? Я, наконец, такой невежда, что даже не знаю, какой это язык? Латинский или итальянский? Или же ни тот, ни другой? Может быть, это какие-нибудь духовные канты, которые пелись в известных случаях, а может быть, и до сих пор поются? Если так, то их можно достать. Больше пока ничего не скажу. Всё второе действие для музыки великолепно. Если что припомню ещё, то мне бы хотелось, чтобы третье действие не кончалось бы словами Анунцио и одного женского хора, а кончалось бы общим ансамблем или по крайней мере смешанным хором; да ещё немного слов для Паоло и Франчески в последнем действии, но об этом со временем.


Пока буду просить Вас ответить мне только на первые два вопроса, и притом опять по адресу Гутхейль.


Преданный Вам С. Рахманинов


© https://senar.ru/letters/132","I hope, dear Modest Ilyich, that this letter will find you still in Petersburg. I am writing to thank you, firstly, for the libretto you sent me, which I generally like very, very much and which I will dwell on. Secondly, I will ask you to fulfill one of my requests and, thirdly, I need your answer to some of my questions regarding the libretto.

The request is as follows. I would like you to compose about thirty stanzas for me for the invisible choir in the prologue. Maybe not thirty, but still a certain number of words, which I would divide and assign to different groups of the choir to sing. In addition, I would like to give the seven stanzas of Virgil (which begin with the words ""My son"") to the choirs, changing, of course, everywhere the pronouns ""she, they"" to ""we"".

Will you find this possible? I would very much like you to say yes, otherwise, not being satisfied with just one phrase in the libretto, that groans are heard, I will have to write a symphonic picture only for the orchestra, which is a little annoying, because I have choirs at my disposal, since I am writing an opera. Give me, for God's sake, these words, Modest Ilyich!

Now a question. I would like to know where you got the content of the first and second acts? Did you work out the plot about Francesca yourself, who is well-known, or was the story of her life written by someone earlier? Then the foreign words that occur during the wedding itself? What do these words mean? Finally, I am such an ignoramus that I do not even know what language this is? Latin or Italian? Or neither? Perhaps these are some spiritual cants that were sung on certain occasions, or perhaps they are still sung? If so, they can be obtained. I will not say anything more for now. The entire second act is magnificent for music. If I recall anything else, I would like the third act not to end with the words of Anunzio and one female choir, but to end with a general ensemble or at least a mixed choir; and a few more words for Paolo and Francesca in the last act, but more about that later.

For now, I will ask you to answer me only the first two questions, and again addressed to Gutheil.

Yours faithfully, S. Rachmaninov

© https://senar.ru/letters/132",personal: check-in,anxious
137,"Letter to N. D. Skalon, 1898",Sergei Rachmaninoff,Н. Д. Скалон,N. D. Skalon,1898,1898-11-13,"[им. Путятино, Владимирской губ","Putyatino, Vladimir province","Хочу Вас поблагодарить, милая Татуша, за Ваше неожиданное желание сказать мне ласковое слово.


На Ваш вопрос, где я? — отвечу: в деревне; но завтра, по требованию доктора, уезжаю на целый месяц, к сожалению, в Москву. Мне приказано лечиться водой и делать себе ежедневные впрыскивания мышьяком.


На Ваши вопросы, что я? — отвечу: да ничего! Ответ на вопрос о том, как мне живётся, будет: плохо.


В заключение распишусь, так же как и Вы, Вашим старым другом.


С. Рахманинов


© https://senar.ru/letters/137","I want to thank you, dear Tatusha, for your unexpected desire to say a kind word to me.

To your question, where am I? — I will answer: in the village; but tomorrow, at the doctor's request, I am leaving for a whole month, unfortunately, to Moscow. I have been ordered to be treated with water and to give myself daily injections of arsenic.

To your questions, what am I? — I will answer: nothing! The answer to the question about how I am living will be: bad.

In conclusion, I will sign, just like you, as your old friend.

S. Rachmaninov

© https://senar.ru/letters/137",personal: check-in,neutral
125,"Letter to S. I. Taneev, 1898",Sergei Rachmaninoff,С. И. Танееву,S. I. Taneev,1898,1898-01-01,Москва,Moscow,"Николай Андреевич приехал. «Садко» идёт [в] пятницу. Уезжает он [в] субботу.

С. Рахманинов","Nikolai Andreevich has arrived. ""Sadko"" is on [on] Friday. He leaves [on] Saturday.

S. Rachmaninov",personal: general,anxious
131,"Letter to S. V. Smolensky, 1898",Sergei Rachmaninoff,С. В. Смоленскому,S. V. Smolensky,1898,1898-08-18,"им. Путятино, Владимирской губ","Putyatino, Vladimir province","Дорогой Степан Васильевич!


Очень прошу Вас ответить мне на следующий вопрос. Артист Шаляпин хотел бы поместить к Вам в училище своего брата, которому 14 лет, который, считаю нужным сказать Вам, довольно плохо знает ноты, довольно плохо читает и пишет, но который, по моему мнению, обладает превосходным музыкальным слухом и большим талантом.


Мотивы, которые заставили Шаляпина искать своему брату место именно у Вас, такие: во-первых, мальчик слишком неподготовлен для какого-нибудь специального музыкального учреждения; во-вторых, этому мальчику, так как он изрядно испорчен, нужно закрытое учреждение, где за ним [был бы] постоянный присмотр. Другие же закрытые учреждения, как, например, кадетский корпус, совсем немыслимы, потому что Шаляпины — крестьяне. Итак, очень прошу Вас известить, найдёте ли Вы возможным поступление к Вам этой осенью маленького Шаляпина? В случае Вашего согласия мы с большим Шаляпиным заедем к Вам для более подробных разговоров.


Искренне Вам преданный С. Рахманинов


P. S. Ваше письмо с извещениями об английской королеве и обо мне (вот так соединение!) прочёл с великим удовольствием и от души благодарю Вас за сообщение их.


© https://senar.ru/letters/131","Dear Stepan Vasilyevich!

I beg you to answer me the following question. The artist Chaliapin would like to place his brother, who is 14 years old, in your school, who, I think it necessary to tell you, knows notes rather poorly, reads and writes rather poorly, but who, in my opinion, has an excellent musical ear and great talent.

The motives that made Chaliapin look for a place for his brother with you are the following: firstly, the boy is too unprepared for any special musical institution; secondly, this boy, since he is quite spoiled, needs a closed institution where he [would have] constant supervision. Other closed institutions, such as, for example, a cadet corps, are completely unthinkable, because the Chaliapins are peasants. So, I beg you to inform me whether you find it possible to enroll little Chaliapin in your school this autumn? If you agree, the great Shalyapin and I will come to you for more detailed conversations.

Sincerely yours, S. Rachmaninov

P.S. I read your letter with the information about the English queen and me (what a connection!) with great pleasure and I thank you from the bottom of my heart for communicating them.

© https://senar.ru/letters/131",personal: check-in,neutral
135,"Letter to S. V. Smolensky, 1898",Sergei Rachmaninoff,С. В. Смоленскому,S. V. Smolensky,1898,1898-10-09,"Имение «Путятино», [Владимирской губ.]","Putyatino, Vladimir province","Дорогой Степан Васильевич!


Я живу в настоящее время в деревне и бываю в Москве только раз в неделю, так что Ваше письмо ко мне пересылали, и эта пересылка отняла несколько лишних дней. Вот почему я отвечаю Вам так поздно. Цель моего письма — от души поблагодарить Вас за присланное приглашение. Я очень сожалею, что не мог быть на Вашем домашнем концерте и прослушать всю интересную программу, которая была Вами назначена к исполнению.


Искренне Вам преданный С. Рахманинов


Мой адрес: Московско-Ярославская железная дорога. Станция Арсаки. Имение «Путятино» Т. С. Любатович. С. В. Рахманинов.


© https://senar.ru/letters/135","Dear Stepan Vasilyevich!

I currently live in the countryside and visit Moscow only once a week, so your letter to me was forwarded, and this forwarding took a few extra days. That is why I am answering you so late. The purpose of my letter is to thank you from the bottom of my heart for the invitation you sent. I am very sorry that I could not be at your home concert and listen to the entire interesting program that you had scheduled for performance.

Sincerely yours, S. Rachmaninov

My address: Moscow-Yaroslavl Railway. Arsaki Station. Putyatino Estate. T. S. Lyubatovich. S. V. Rachmaninov.

© https://senar.ru/letters/135",professional: logistics,grateful
138,"Letter to V. I. Rebikov, 1898",Sergei Rachmaninoff,В. И. Ребикову,V. I. Rebikov,1898,1898-09 - 1989-11,-,-,"[Осень 1898 г.]
Многоуважаемый господин Ребиков.


Я [прошу] Вас обратиться к К. А. Гутхейлю (Музыкальный магазин, Кузнецкий мост), который Вам и пришлёт мою карточку и кой-какие сведения обо мне.


Мне остаётся от души поблагодарить Вас и Общество за желание сыграть что-нибудь моё.


Жму вашу руку.


Преданный Вам С. Рахманинов


© https://senar.ru/letters/138","[Autumn 1898]
Dear Mr. Rebikov.

I [ask] you to contact K. A. Gutheil (Music shop, Kuznetsky Most), who will send you my card and some information about me.

I can only thank you and the Society from the bottom of my heart for wanting to play something of mine.

I shake your hand.

Yours faithfully, S. Rachmaninov

© https://senar.ru/letters/138",personal: check-in,grateful
143,"Letter to A. S. Arensky, 1899",Sergei Rachmaninoff,А. С. Аренскому,A. S. Arensky,1899,1899-04-17,Москва,Moscow,"Дорогой Антон Степанович!
 
 
 Вчера я получил твоё письмо, где ты сообщаешь, что «Алеко» предполагают поставить в Таврическом дворце. Конечно, с моей стороны препятствий нет и быть не может. Я очень рад и не знаю, кого мне благодарить за это желание и решение поставить мою оперу. Мне жаль только, что я об этом не узнал раньше. Мне кажется, что для такого торжества я бы мог написать специально что-нибудь более достойное постановки, чем «Алеко», которого я стал уже запрещать ставить на сценах. Всё-таки здесь я рассчитываю на хорошее исполнение и хочу думать, что это-то меня и сгладит немножко.
 
 
 Назначить и рекомендовать кого-нибудь на сольные партии я не могу, потому что очень мало или совсем не знаю петербургских певцов. Я тебя хочу просить об этом. Ты их, конечно, всех знаешь, а значит и можешь сказать, кому какая роль подходит. Будь так добр, Антон Степанович, — сделай мне это одолжение. Нечего и говорить, конечно, что я заранее одобряю и доволен твоим выбором.
 
 
 В первый момент, как я прочитал твоё письмо, мне пришло в голову, что лучше Земфиры — Сионицкой и Шаляпина — Алеко я никого не найду. Но согласятся ли они? Как бы то ни было, но я прошу тебя подождать назначать кого-нибудь на эти роли дней пять, шесть, когда я тебе и сообщу результаты.
 
 
 Когда начнутся репетиции? Сообщи мне, пожалуйста. Где они будут? Какой хор будет петь? Прости, что заваливаю тебя вопросами, но меня всё это очень интересует. Пока до свиданья.
 
 
 Искренно тебе преданный Твой
 
 
 С. Рахманинов
 
 
 © https://senar.ru/letters/143","Dear Anton Stepanovich!
 
 Yesterday I received your letter, where you inform me that ""Aleko"" is supposed to be staged in the Tauride Palace. Of course, there are no obstacles on my part and there cannot be any. I am very happy and do not know who to thank for this desire and decision to stage my opera. I only regret that I did not find out about this earlier. It seems to me that for such a celebration I could have written something more worthy of staging than ""Aleko"", which I have already begun to forbid to be staged on stages. After all, here I am counting on a good performance and I want to think that this will smooth me over a little.
 
 I cannot appoint or recommend anyone for solo parts, because I know very few or no Petersburg singers. I want to ask you about this. Of course, you know them all, and therefore you can tell me which role suits whom. Be so kind, Anton Stepanovich, - do me this favor. Needless to say, of course, that I approve of your choice in advance and am pleased with it.
 
 The first moment I read your letter, it occurred to me that I would not find anyone better than Zemfira - Sionitskaya and Shalyapin - Aleko. But will they agree? Be that as it may, but I ask you to wait five or six days to appoint someone for these roles, when I will tell you the results.
 
 When will the rehearsals begin? Let me know, please. Where will they be? Which choir will sing? Forgive me for bombarding you with questions, but I am very interested in all this. Goodbye for now.
 
 Sincerely devoted to you, Yours
 
 S. Rachmaninov
 
 © https://senar.ru/letters/143",professional: logistics,despair
140,"Letter to A. V. Zataevich, 1899",Sergei Rachmaninoff,А. В. Затаевичу,A. V. Zataevich,1899,1899-03-03,Москва,Moscow,"Очень рад был получить Ваше письмо и Ваши вещи, милый друг Александр Викторович. Особо благодарю Вас за посвящение и за тронувшую меня надпись. Я, конечно, нисколько на Вас не сержусь, да и не имею этого права, потому что в этом и сам бываю неоднократно виноват пред Вами. Мы с Вами оба, кажется, ужасно ленивы на письма. Не будем же считаться ими. Поддерживаем мы нашу корреспонденцию настолько, насколько нам наша лень позволяет, — отношения наши всё-таки отличные и... слава богу. Раз навсегда условимся не сердиться друг на друга. На этот раз, впрочем, моё письмо будет коротко не от лени. Я действительно теперь очень занят, потому что в конце марта уезжаю в Лондон, где играю и дирижирую. Кроме того, писем для ответа у меня накопилось штук 15. Так же как и Вы, ношу их с собой в кармане и каждый день, ложась спать и вынимая эти письма для того, чтобы положить их на ночной столик, я чувствую сильнейшее угрызение совести.
 
 
 Нового я так же, как и Вы, опять-таки ничего не написал. Или нам обоим некогда или мы ленивы и на музыкальные письма.
 
 
 Пока до свиданья. Жму Вашу руку. Передайте Вашей жене мой привет и благодарность за поклон. Кстати, спросите её, как третье лицо, не находит ли она, что мы с Вами несколько похожи друг на друга?
 
 
 С. Рахманинов
 
 
 © https://senar.ru/letters/140","I was very glad to receive your letter and your things, my dear friend Alexander Viktorovich. I especially thank you for the dedication and for the inscription that touched me. Of course, I am not angry with you at all, and I have no right to be, because I myself have been guilty of this before you more than once. It seems that you and I are both terribly lazy with letters. Let us not take them for granted. We maintain our correspondence as much as our laziness allows us to - our relations are still excellent and... thank God. Let us agree once and for all not to be angry with each other. This time, however, my letter will be short, not because of laziness. I am really very busy now, because at the end of March I am leaving for London, where I play and conduct. Besides, I have about 15 letters to answer. Just like you, I carry them in my pocket and every day, when I go to bed and take these letters out to put them on the night table, I feel a strong pang of conscience.
 
 I, just like you, have not written anything new. Either we both have no time or we are too lazy for musical letters.
 
 Goodbye for now. I shake your hand. Give your wife my regards and gratitude for the greeting. By the way, ask her, as a third party, if she does not find that you and I are somewhat similar to each other?
 
 S. Rachmaninov
 
 © https://senar.ru/letters/140",personal: check-in,despair
141,"Letter to L. D. Skalon, 1899",Sergei Rachmaninoff,Л. Д. Скалон,L. D. Skalon,1899,1899-03-04,Москва,Moscow,"Милая Лёля! Исполняю своё давнишнее обещание и посылаю Вам свою карточку. Простите, если это окажется поздно.
 
 Будьте здоровы.
 
 С. Рахманинов","Dear Lelya! I am fulfilling my long-standing promise and sending you my card. Forgive me if it is late.
 
 Be healthy.
 
 S. Rachmaninov",personal: apology,grateful
142,"Letter to L. D. Skalon, 1899",Sergei Rachmaninoff,Л. Д. Скалон,L. D. Skalon,1899,1899-03-30,Москва,Moscow,"«Старый пёсик» вам очень благодарен, милая Лёля, за ваше славное, длинное письмо. Жалеет, что не может вам ответить тем же, так как у него осталось ещё много хлопот и дел по случаю его отбытия сегодня в Лондон. «Старый пёсик» служить не любит, а тут ещё более сокрушается, что эта служба гонит его бог знает куда, и тем самым хотя бы мешает поддержать свою старую дружбу с приятной для его старого сердца Лёлюшей.
 
 
 Vieux chien
 
 
 © https://senar.ru/letters/142","""Old Doggie"" is very grateful to you, dear Lelya, for your nice, long letter. He regrets that he cannot answer you in kind, since he still has a lot of troubles and things to do on the occasion of his departure today to London. ""Old Doggie"" does not like to serve, and here he is even more upset that this service drives him God knows where, and thereby at least prevents him from maintaining his old friendship with Lelyusha, who is pleasant to his old heart.
 
 Vieux chien
 
 © https://senar.ru/letters/142",personal: check-in,apologetic
